{
    "caller": {
      "identifier": "2vxsx-fae",
      "isAnonymous": true
    },
    "canister": {
      "identifier": "tzvxm-jqaaa-aaaaj-qabga-cai",
      "subnet": "jtdsg-3h6gi-hs7o5-z2soi-43w3z-soyl3-ajnp3-ekni5-sw553-5kw67-nqe",
      "moduleHash": "5ac0453ff6787f7c5670e8bb55b5ddeb54ae6cec07ac1e9a95aee86b44988c04",
      "controllers": [
        "tmsgb-iyaaa-aaaaj-qabfq-cai"
      ]
    },
    "meta": {
      "originalRequestId": "56eb04efba57477f0829644e3a2e7bd75e39afa37f8393248fbf5f67dda09ad5",
      "type": "query",
      "status": "replied",
      "consensus": false,
      "verified": null,
      "boundary": {
        "_stub": true,
        "_url": true,
        "val": "https://raw.ic0.app/api/v2/canister/tzvxm-jqaaa-aaaaj-qabga-cai/query"
      }
    },
    "method": {
      "name": "getScoreCount",
      "query": true
    },
    "timing": {
      "timestamp": "2022-08-15T21:05:13.257Z",
      "requestCount": 1
    },
    "requests": {
      "56eb04efba57477f0829644e3a2e7bd75e39afa37f8393248fbf5f67dda09ad5": {
        "caller": {
          "identifier": "2vxsx-fae",
          "isAnonymous": true
        },
        "method": {
          "name": "getScoreCount",
          "query": true
        },
        "canister": {
          "identifier": "tzvxm-jqaaa-aaaaj-qabga-cai",
          "subnet": "jtdsg-3h6gi-hs7o5-z2soi-43w3z-soyl3-ajnp3-ekni5-sw553-5kw67-nqe",
          "moduleHash": "5ac0453ff6787f7c5670e8bb55b5ddeb54ae6cec07ac1e9a95aee86b44988c04",
          "controllers": [
            "tmsgb-iyaaa-aaaaj-qabfq-cai"
          ]
        },
        "meta": {
          "originalRequestId": "56eb04efba57477f0829644e3a2e7bd75e39afa37f8393248fbf5f67dda09ad5",
          "requestId": "56eb04efba57477f0829644e3a2e7bd75e39afa37f8393248fbf5f67dda09ad5",
          "type": "query",
          "boundary": {
            "_stub": true,
            "_url": true,
            "val": "https://raw.ic0.app/api/v2/canister/tzvxm-jqaaa-aaaaj-qabga-cai/query"
          }
        },
        "timing": {
          "timestamp": "2022-08-15T21:05:13.257Z"
        },
        "request": {
          "boundary": {
            "_stub": true,
            "_url": true,
            "val": "https://raw.ic0.app/api/v2/canister/tzvxm-jqaaa-aaaaj-qabga-cai/query"
          },
          "message": "56eb04efba57477f0829644e3a2e7bd75e39afa37f8393248fbf5f67dda09ad5",
          "requestId": "56eb04efba57477f0829644e3a2e7bd75e39afa37f8393248fbf5f67dda09ad5",
          "sender": {
            "_stub": true,
            "_principal": true,
            "val": "2vxsx-fae"
          },
          "requestType": "query",
          "ingressExpiry": {
            "_stub": true,
            "_bigint": true,
            "val": "1660597749791000000"
          },
          "canisterId": "tzvxm-jqaaa-aaaaj-qabga-cai",
          "method": "getScoreCount",
          "args": {
            "result": null,
            "withInterface": true
          }
        },
        "response": {
          "status": "replied",
          "reply": {
            "result": {
              "_stub": true,
              "_bigint": true,
              "val": "180"
            },
            "withInterface": true
          }
        }
      }
    }
}