{
    "caller": {
      "identifier": "mr2uc-ob4zm-yik2z-vbsny-qsj2h-2np4i-drw75-7seho-a6jjx-5stsu-fqe",
      "isAnonymous": false
    },
    "canister": {
      "identifier": "cea4l-ryaaa-aaaae-aaa6a-cai",
      "subnet": "shefu-t3kr5-t5q3w-mqmdq-jabyv-vyvtf-cyyey-3kmo4-toyln-emubw-4qe",
      "moduleHash": "cfbc6e42e626947d7cf5b7976d58422c0cdf3e5c04c4d1e31384343cb0b6145f",
      "controllers": [
        "hy3go-2qaaa-aaaae-aaabq-cai",
        "ins6m-vyaaa-aaaag-qabuq-cai",
        "xo4am-ryaaa-aaaai-qh4va-cai",
        "ho5nh-4iaaa-aaaaj-aaipa-cai",
        "vi77x-kqaaa-aaaak-aadyq-cai",
        "zheur-rqaaa-aaaal-qanoq-cai",
        "ljmf3-4iaaa-aaaan-qaafq-cai",
        "auw2h-nsumg-eq552-wz7u7-ckc2l-teo22-wjsea-gsprn-kk6ln-rofyd-bqe"
      ]
    },
    "meta": {
      "originalRequestId": "afddfc217b38f2f2ad4cd4893bd03fbc10a43c4bce015d025ae0f51493a5b851",
      "type": "query",
      "status": "replied",
      "consensus": false,
      "verified": null,
      "boundary": {
        "_stub": true,
        "_url": true,
        "val": "https://boundary.ic0.app/api/v2/canister/cea4l-ryaaa-aaaae-aaa6a-cai/query"
      }
    },
    "method": {
      "name": "getFollowCounts",
      "query": true
    },
    "timing": {
      "timestamp": "2022-08-16T04:13:45.507Z",
      "requestCount": 1
    },
    "requests": {
      "afddfc217b38f2f2ad4cd4893bd03fbc10a43c4bce015d025ae0f51493a5b851": {
        "caller": {
          "identifier": "mr2uc-ob4zm-yik2z-vbsny-qsj2h-2np4i-drw75-7seho-a6jjx-5stsu-fqe",
          "isAnonymous": false
        },
        "method": {
          "name": "getFollowCounts",
          "query": true
        },
        "canister": {
          "identifier": "cea4l-ryaaa-aaaae-aaa6a-cai",
          "subnet": "shefu-t3kr5-t5q3w-mqmdq-jabyv-vyvtf-cyyey-3kmo4-toyln-emubw-4qe",
          "moduleHash": "cfbc6e42e626947d7cf5b7976d58422c0cdf3e5c04c4d1e31384343cb0b6145f",
          "controllers": [
            "hy3go-2qaaa-aaaae-aaabq-cai",
            "ins6m-vyaaa-aaaag-qabuq-cai",
            "xo4am-ryaaa-aaaai-qh4va-cai",
            "ho5nh-4iaaa-aaaaj-aaipa-cai",
            "vi77x-kqaaa-aaaak-aadyq-cai",
            "zheur-rqaaa-aaaal-qanoq-cai",
            "ljmf3-4iaaa-aaaan-qaafq-cai",
            "auw2h-nsumg-eq552-wz7u7-ckc2l-teo22-wjsea-gsprn-kk6ln-rofyd-bqe"
          ]
        },
        "meta": {
          "originalRequestId": "afddfc217b38f2f2ad4cd4893bd03fbc10a43c4bce015d025ae0f51493a5b851",
          "requestId": "afddfc217b38f2f2ad4cd4893bd03fbc10a43c4bce015d025ae0f51493a5b851",
          "type": "query",
          "boundary": {
            "_stub": true,
            "_url": true,
            "val": "https://boundary.ic0.app/api/v2/canister/cea4l-ryaaa-aaaae-aaa6a-cai/query"
          }
        },
        "timing": {
          "timestamp": "2022-08-16T04:13:45.507Z"
        },
        "request": {
          "boundary": {
            "_stub": true,
            "_url": true,
            "val": "https://boundary.ic0.app/api/v2/canister/cea4l-ryaaa-aaaae-aaa6a-cai/query"
          },
          "message": "afddfc217b38f2f2ad4cd4893bd03fbc10a43c4bce015d025ae0f51493a5b851",
          "requestId": "afddfc217b38f2f2ad4cd4893bd03fbc10a43c4bce015d025ae0f51493a5b851",
          "sender": {
            "_stub": true,
            "_principal": true,
            "val": "mr2uc-ob4zm-yik2z-vbsny-qsj2h-2np4i-drw75-7seho-a6jjx-5stsu-fqe"
          },
          "requestType": "query",
          "ingressExpiry": {
            "_stub": true,
            "_bigint": true,
            "val": "1660623462958000000"
          },
          "canisterId": "cea4l-ryaaa-aaaae-aaa6a-cai",
          "method": "getFollowCounts",
          "args": {
            "result": [
              {
                "_stub": true,
                "_bigint": true,
                "val": "37921049911771137"
              }
            ],
            "withInterface": false
          }
        },
        "response": {
          "status": "replied",
          "reply": {
            "result": [
              {
                "_2037573648_": {
                  "_stub": true,
                  "_bigint": true,
                  "val": "33"
                },
                "_3407360661_": {
                  "_stub": true,
                  "_bigint": true,
                  "val": "135"
                }
              }
            ],
            "withInterface": false
          }
        }
      }
    }
  }